{"applicability_gate_state":"UNASSESSED","assumptions":["kernel acceptance is the legality oracle","partial-map absence is not impossibility","geometry is proposal/routing only","retrieval, progress prediction, and plan revision are separable causal coordinates"],"development_benchmark_id":"VTG-LEAN-FACTORIAL-DEV-V2","development_case_ids":["vtg2-dev-search","vtg2-dev-retrieval","vtg2-dev-progress","vtg2-dev-harness","vtg2-dev-hostile"],"evidence_pointers":["research:p5_p6_saturation_v1/ROUND_001.md","primary:arXiv:2502.03438","primary:arXiv:2502.17925","primary:arXiv:2605.13137","primary:arXiv:2605.26959","primary:arXiv:2606.03303"],"falsifier":"After matching/ablating search, retrieval, proof-progress and recursive-harness effects, VTG has no distinguishable fully-costed verified root-level residual or any preservation/kernel gate regresses.","fresh_assurance_benchmark_id":"VTG-LEAN-FACTORIAL-FRESH-V2","fresh_assurance_case_ids":["vtg2-fresh-family-a","vtg2-fresh-family-b","vtg2-fresh-research-level"],"frozen_before_implementation":true,"frozen_before_outcome_access":true,"grants_promotion_authority":false,"grants_scientific_authority":false,"hard_gate_obligations":["kernel-valid proof only","no abstract route mints theorem authority","quotient/portal preservation clean","factorial component identity frozen","development/fresh family disjointness"],"mechanic_id":"verified_transformation_geometry","mechanism_gate_state":"UNASSESSED","minimal_counterexamples":["geometry correlates with progress but LeanProgress parent matches it","retrieval improvement explains proof success with geometry disabled","recursive plan revision solves theorem while local geometry adds no value","locally descending geometry enters dead end","quotient/portal changes remaining proof obligations","geometry construction costs exceed saved search","stale geometry after library change"],"novelty_residual":"Incremental verified search value of explicit reachability geometry after controlling retrieval, progress-value estimation, and recursive planning.","object_description":"Incremental value of an explicit verifier-bound reachability geometry after separating proof search, premise retrieval, learned proof progress, and recursive proof-plan/harness effects.","oracle_or_lower_bound":"Kernel legality is exact; exact shortest verified cost-to-go is computed only on materialized finite proof graphs as an oracle geometry. A factorial/ablation design bounds incremental geometry value after retrieval/progress/harness factors.","packet_content_sha256":"a7035017128ec0af8956a4df9e3daa19745d4a33fa4d40de5b9fe453ddb53911","packet_id":"MRP-P5-VTG-LEAN-V2","parent_method_sha":"e5b1e3fb2c231381ca6eacf7122710a0d5e7f282","permitted_publication_claim":"Scoped incremental VTG routing/search result on the frozen Lean factorial benchmark; no theorem-truth, global-geometry, or autonomous-mathematician claim.","prior_art_equivalence_map":["best-first proof-tree search","HTPS AND/OR search","learned proof-progress/value estimation","global premise retrieval","recursive proof-plan revision/decomposition","structure-aware proof mining"],"qoi":"Paired fully-costed verified theorem-search benefit attributable specifically to the VTG geometry coordinate beyond the strongest factorized search/retrieval/progress/harness parents.","replaces_promotion_gate":false,"required_telemetry_fields":["sample_id","seed","measured_quantity","total_cost","hard_gate_status","strongest_parent_id","states_expanded","kernel_calls","wall_time","retrieval_cost","progress_model_cost","planning_cost","geometry_build_cost","decode_cost"],"same_system_ablation":"Factorial same-theorem comparison with VTG geometry disabled while retrieval/progress/harness/search components are held fixed.","schema_version":"mechanic-research-packet-v1","scope":["Lean 4 theorem proving","frozen Lean/mathlib subject","matched model/tactic generator/verifier/resources","retrieval and harness factors explicitly controlled"],"selection_case_ids":["vtg2-dev-search","vtg2-dev-retrieval","vtg2-dev-progress","vtg2-dev-harness"],"strongest_parents":[{"cost_equation":"retrieval+model+tactic_generation+search+Lean_kernel+wall","cost_model_id":"vtg-factorial-cost-v2","evidence_pointers":[],"implementation_refs":["primary:arXiv:2502.03438","adapter:future/vtg_bfs_prover_v2"],"justification":"scaled best-first is a strong simple search parent","parent_id":"scaled_best_first_BFS_Prover"},{"cost_equation":"retrieval+model+tactic_generation+tree_search+Lean_kernel+wall","cost_model_id":"vtg-factorial-cost-v2","evidence_pointers":[],"implementation_refs":["primary:arXiv:2205.11491","adapter:future/vtg_htps_v2"],"justification":"structured AND/OR proof-tree parent","parent_id":"HTPS_AND_OR_search"},{"cost_equation":"progress_model+best_first_search+Lean_kernel+wall","cost_model_id":"vtg-factorial-cost-v2","evidence_pointers":[],"implementation_refs":["primary:arXiv:2502.17925","adapter:future/vtg_leanprogress_v1"],"justification":"direct learned proof-progress/value parent adjacent to a goal-relative field","parent_id":"LeanProgress_value_search"},{"cost_equation":"global_retrieval+fixed_prover+Lean_kernel+wall","cost_model_id":"vtg-factorial-cost-v2","evidence_pointers":[],"implementation_refs":["primary:arXiv:2605.13137","adapter:future/vtg_leansearch_v2"],"justification":"controls gains caused by improved global premise retrieval","parent_id":"LeanSearch_v2_fixed_prover"},{"cost_equation":"planning+decomposition+revision+Lean_kernel+wall","cost_model_id":"vtg-factorial-cost-v2","evidence_pointers":[],"implementation_refs":["primary:arXiv:2605.26959","primary:arXiv:2606.03303","adapter:future/vtg_recursive_harness_v1"],"justification":"controls gains from recursive proof-plan decomposition/revision rather than geometry","parent_id":"recursive_plan_harness"}],"total_cost_equation":"candidate_total = retrieval + progress_estimation + planning/decomposition + model/tactic_generation + geometry_build/update + search + Lean_kernel + decode + verification","variant_id":"vtg_lean_geometry_v2"}
