{
  "schema_version": "mechanic-research-packet-v1",
  "packet_id": "MRP-CLOSURE-ARN-DISCRIMINATOR-V2",
  "mechanic_id": "ancestor_challenge_discriminator",
  "variant_id": "arn_local_vs_parent_discriminator_v2",
  "parent_method_sha": "d0e4ac3109d55ff10a0c32168f369bc57fbf39cd",
  "object_description": "A successor ARN local-vs-parent discriminator over the untouched confirmatory split, with distractor_similarity frozen as a blocking factor before execution and a representation ladder that includes non-lexical argument/event/role structure rather than only the lexical channel deliberately targeted by the distractor construction.",
  "qoi": "Whether recoverable source-grounded analogue signal persists within both pre-registered distractor-similarity strata under any registered representation, while holding the evaluator and observation contract fixed; only a valid failure across strata may challenge the parent abstraction.",
  "scope": ["ARN external-corpus ancestor challenge", "untouched confirmatory split only", "source-grounded observation contract", "no post-outcome re-stratification"],
  "assumptions": ["the confirmatory split was not used by discriminator v1", "distractor_similarity is registered only as a blocking factor and is not candidate-visible", "features may read only query_narrative and candidate narrative text", "the correct_answer column is evaluator-only", "all representation families and combination rules are frozen before confirmatory outcomes"],
  "strongest_parents": [
    {"parent_id": "construct_independence_stratum_homogeneity_v2", "implementation_refs": ["research/self_rakl_closure_v1/PACKET_construct_independence_stratum_homogeneity_v2.json"], "cost_model_id": "arn-discriminator-v2-cost", "cost_equation": "construct_independence_v2_admission + discriminator_execution", "justification": "The ARN successor must pass the fifth obligation that #731 identified after v1 admitted the non-probative aggregate.", "evidence_pointers": ["merge:#731@d0e4ac3109d55ff10a0c32168f369bc57fbf39cd"]},
    {"parent_id": "arn_local_vs_parent_discriminator_v1", "implementation_refs": ["research/arn_local_vs_parent_discriminator_v1/PROTOCOL.json", "research/arn_local_vs_parent_discriminator_v1/RESULT.json", "research/arn_local_vs_parent_discriminator_v1/PROBE_VALIDITY.json"], "cost_model_id": "arn-discriminator-v2-cost", "cost_equation": "feature_construction + scoring + permutation_controls + validity_checks", "justification": "Immediate predecessor. Its aggregate lexical null was invalidated because opposite distractor-similarity strata cancelled, so v2 must register the blocking factor before outcome access.", "evidence_pointers": ["merge:#729@2c510d33ef92534595f74012a49117805aaaa571"]},
    {"parent_id": "arn_v5_multifamily_extractor_family", "implementation_refs": ["research/paper2_external_corpus_v1/PROTOCOL_V5_REDUCER.json", "research/paper2_external_corpus_v1/results_v5_multifamily/RESULT.json"], "cost_model_id": "arn-discriminator-v2-cost", "cost_equation": "representation_extraction + correspondence_scoring + downstream_evaluation", "justification": "Strongest executed local family; learned predicate-argument, vocabulary-masked and semantic controls all ended NEGATIVE__CAPABILITY_ABSENT.", "evidence_pointers": ["merge:#709@f2f9beafe69069bc7043439ef61488b49df25db8"]},
    {"parent_id": "surface_lexical_probe_blocked_by_distractor_band", "implementation_refs": ["research/arn_local_vs_parent_discriminator_v1/run_discriminator.py"], "cost_model_id": "arn-discriminator-v2-cost", "cost_equation": "lexical_features + scoring", "justification": "Retained as a registered negative control: if non-lexical representations only reproduce the same opposite-signed surface pattern, the successor has not escaped the design artifact.", "evidence_pointers": ["research/arn_local_vs_parent_discriminator_v1/PROBE_VALIDITY.json"]}
  ],
  "prior_art_equivalence_map": ["blocked/stratified experimental design", "argument-structure and semantic-role correspondence", "event-order/process correspondence", "structure mapping under adversarial lexical distractors", "RAKL AncestorChallenge local-vs-parent discriminator"],
  "oracle_or_lower_bound": "Known-answer injected-signal fixtures within each registered distractor band prove that the scoring/permutation machinery can detect both lexical and non-lexical signal when present. Parent abstraction may be challenged only if every preregistered representation fails within each stratum and all positive-signal fixtures pass; an aggregate null alone is never sufficient.",
  "minimal_counterexamples": ["aggregate chance with opposite within-band effects", "one stratum recovers signal while another does not", "non-lexical representation leaks correct_answer or distractor band", "argument/event/role representation reproduces lexical anti-signal by construction", "positive-signal fixture cannot pass the gate", "one favourable stratum is selected only after outcomes"],
  "development_benchmark_id": "ARN-DISCRIMINATOR-V2-KNOWN-WORLD-AND-V1-DEV",
  "development_case_ids": ["arn2-dev-positive-lexical", "arn2-dev-positive-role", "arn2-dev-positive-event", "arn2-dev-v1-high-band", "arn2-dev-v1-low-band", "arn2-dev-leak-hostile"],
  "fresh_assurance_benchmark_id": "ARN-DISCRIMINATOR-V2-CONFIRM",
  "fresh_assurance_case_ids": ["arn2-confirm-high-band", "arn2-confirm-low-band"],
  "selection_case_ids": ["arn2-dev-positive-lexical", "arn2-dev-positive-role", "arn2-dev-positive-event", "arn2-dev-v1-high-band", "arn2-dev-v1-low-band", "arn2-dev-leak-hostile"],
  "falsifier": "The successor remains non-probative if positive-signal fixtures fail, if any representation leaks evaluator-only fields, or if registered strata still show cancellation/heterogeneity that the frozen rule cannot interpret. The parent abstraction is challenged only when all registered representations fail within both strata under a valid probe.",
  "same_system_ablation": "Same confirmatory rows/evaluator/permutation machinery with (a) lexical v1 features only and (b) each non-lexical representation family removed in turn.",
  "hard_gate_obligations": ["distractor_similarity registered pre-outcome as blocking factor", "distractor_similarity and correct_answer hidden from candidate features", "construct-independence v2 including STRATUM_HOMOGENEITY passes", "positive-signal known-world fixtures pass", "stratum-specific results reported before aggregate", "no post-outcome stratum or representation selection", "ancestor ascent remains blocked unless complete packet and valid discriminator support it"],
  "required_telemetry_fields": ["row_id", "distractor_band", "representation_id", "feature_score", "prediction", "gold", "permutation_p", "stratum_accuracy", "aggregate_accuracy", "positive_fixture_status", "construct_independence_verdict", "verdict", "total_cost"],
  "total_cost_equation": "discriminator_total = representation_extraction + within_stratum_scoring + permutation_controls + positive_fixture_controls + validity_audit",
  "novelty_residual": "A pre-stratified, non-lexical successor that directly repairs the specific design artifact found by #729 while preserving the exact AncestorChallenge requirement instead of treating repeated failure as parent evidence.",
  "permitted_publication_claim": "Only a responsibility-localization claim under the frozen ARN observation/evaluator contract. No analogy-utility or scientific-authority claim; a negative valid discriminator may license an ancestor challenge but does not itself prove the parent false.",
  "evidence_pointers": ["issue:#730", "merge:#731@d0e4ac3109d55ff10a0c32168f369bc57fbf39cd", "merge:#729@2c510d33ef92534595f74012a49117805aaaa571", "research/arn_local_vs_parent_discriminator_v1/CORE.md", "research/paper2_external_corpus_v1/results_v5_multifamily/RESULT.json"],
  "mechanism_gate_state": "UNASSESSED",
  "applicability_gate_state": "UNASSESSED",
  "frozen_before_implementation": true,
  "frozen_before_outcome_access": true,
  "packet_content_sha256": "13c03b7562e7fba5da1539dbfbcf2fdf5296fe9df6dc6c5f670ee1b6f80b8aea",
  "grants_scientific_authority": false,
  "grants_promotion_authority": false,
  "replaces_promotion_gate": false
}
