{
  "schema_version": "mechanic-research-packet-v1",
  "packet_id": "MRP-CLOSURE-ARN-LOCAL-VS-PARENT-V1",
  "mechanic_id": "ancestor_challenge_discriminator",
  "variant_id": "arn_local_vs_parent_discriminator_v1",
  "parent_method_sha": "83f63c93f338fad50a02281b9d99dfb529d920fb",
  "object_description": "A discriminator between failure of the current ARN extraction/mapping family and failure of the parent abstraction that usable prose-level relational structure exists for the registered downstream analogy decision.",
  "qoi": "Whether supplying independently grounded relational structure while holding the downstream evaluator fixed materially restores the registered decision, thereby localizing responsibility below the parent abstraction rather than licensing ascent by repeated raw failure.",
  "scope": [
    "Paper II ARN/scientific-analogy lineage",
    "ancestor-challenge packet completion only",
    "fresh or quarantined-from-design externally grounded mapping cases"
  ],
  "assumptions": [
    "the downstream evaluator and gate remain fixed across local-extractor and supplied-structure arms",
    "supplied structure is independently grounded and candidate-invisible",
    "existing ARN v1-v5 negatives remain immutable development history",
    "no ascent is licensed from repeated local failures without this discriminator"
  ],
  "strongest_parents": [
    {
      "parent_id": "arn_v5_multifamily_admissible_extractor_family",
      "implementation_refs": [
        "research/paper2_external_corpus_v1/results_v5_multifamily/RESULT.json",
        "research/paper2_external_corpus_v1/PROTOCOL_V5_REDUCER.json"
      ],
      "cost_model_id": "arn-discriminator-matched-v1",
      "cost_equation": "extraction + mapping + downstream_evaluation",
      "justification": "Strongest executed local family: multiple learned/structured variants were admissible yet ended NEGATIVE__CAPABILITY_ABSENT.",
      "evidence_pointers": ["merge:#709@f2f9beafe69069bc7043439ef61488b49df25db8"]
    },
    {
      "parent_id": "external_human_grounded_structure_oracle",
      "implementation_refs": [
        "research/paper2_scientific_analogy_external_v1/PROTOCOL.json",
        "primary:doi:10.18653/v1/2023.findings-emnlp.160"
      ],
      "cost_model_id": "arn-discriminator-matched-v1",
      "cost_equation": "grounded_mapping_materialization + downstream_evaluation",
      "justification": "The local-vs-parent question requires an arm where relational structure is supplied independently rather than extracted by the failed local family.",
      "evidence_pointers": ["research/paper2_scientific_analogy_external_v1/PROTOCOL.json"]
    },
    {
      "parent_id": "published_style_structure_abduction_same_subject",
      "implementation_refs": ["research/paper2_scientific_analogy_external_v1/AMENDMENT_01_STRONGEST_PARENT_AND_ACQUISITION.json"],
      "cost_model_id": "arn-discriminator-matched-v1",
      "cost_equation": "model_calls + structure_abduction + downstream_evaluation",
      "justification": "A strong semantic/structure-abduction parent prevents an oracle-only contrast from being mistaken for evidence that the RAKL representation is uniquely needed.",
      "evidence_pointers": ["issue:#661"]
    }
  ],
  "prior_art_equivalence_map": [
    "oracle-feature / gold-structure ablation",
    "causal intervention on representation while holding evaluator fixed",
    "published-style structure-abduction parent",
    "RAKL AncestorChallenge local-vs-parent discriminator"
  ],
  "oracle_or_lower_bound": "The independently supplied gold/human mapping arm is an upper-bound diagnostic for extraction responsibility: if the fixed downstream decision still cannot clear its registered gates with correct structure supplied, more local extractor search cannot by itself close the parent abstraction. It is never a fair performance parent.",
  "minimal_counterexamples": [
    "local extractor fails but supplied human structure passes: do not ascend; extraction remains responsible",
    "local extractor and supplied structure both fail: parent abstraction/evaluator/question remains challenged",
    "local extractor passes on fresh cases: repeated historical failure does not justify ascent",
    "oracle structure passes only because evaluator sees answer-bearing annotations",
    "structure-abduction parent matches supplied-structure arm at lower cost"
  ],
  "development_benchmark_id": "ARN-LOCAL-VS-PARENT-DEV-V1",
  "development_case_ids": [
    "arn-dev-v3-negative",
    "arn-dev-v5-multifamily-negative",
    "arn-dev-gold-structure-sanity",
    "arn-dev-evaluator-leak-hostile"
  ],
  "fresh_assurance_benchmark_id": "ARN-LOCAL-VS-PARENT-FRESH-V1",
  "fresh_assurance_case_ids": [
    "arn-fresh-scar-block-a",
    "arn-fresh-scar-block-b",
    "arn-fresh-propara-block-a",
    "arn-fresh-propara-block-b"
  ],
  "selection_case_ids": [
    "arn-dev-v3-negative",
    "arn-dev-v5-multifamily-negative",
    "arn-dev-gold-structure-sanity",
    "arn-dev-evaluator-leak-hostile"
  ],
  "falsifier": "The independently supplied-structure arm fails to separate the parent abstraction from the strongest local extractor, or the result depends on evaluator/gold leakage rather than the representation intervention.",
  "same_system_ablation": "Hold case bytes, downstream evaluator, threshold, and resource accounting fixed; replace only the local extraction/mapping stage with independently supplied grounded structure.",
  "hard_gate_obligations": [
    "same downstream evaluator epoch across arms",
    "supplied structure candidate-invisible",
    "construct-independence gate passes",
    "local and parent arms have explicit cost accounting",
    "historical ARN negatives preserved",
    "no ASCEND unless AncestorChallenge packet is complete"
  ],
  "required_telemetry_fields": [
    "case_id",
    "arm_id",
    "structure_source",
    "evaluator_epoch",
    "decision",
    "mapping_score",
    "valid_accept",
    "invalid_false_accept",
    "cannot_check",
    "total_cost",
    "construct_independence_verdict"
  ],
  "total_cost_equation": "arm_total = acquisition/materialization + extraction_or_supplied_structure + mapping + downstream_decision + verification",
  "novelty_residual": "A parent-discriminating intervention that fills the exact missing `local_vs_parent_discriminator_id` field of the ARN AncestorChallenge instead of treating repeated failure as ascent evidence.",
  "permitted_publication_claim": "At most: on the frozen discriminator cases, responsibility localized to local extraction, parent abstraction/evaluator, or remained CANNOT_CHECK. The discriminator alone does not establish analogy utility or scientific authority.",
  "evidence_pointers": [
    "issue:#730",
    "research/self_rakl_recursive_question_audit_v1/CORE.md",
    "research/self_rakl_recursive_question_audit_v1/OPEN_ITEMS_DECISIONS.json",
    "research/paper2_external_corpus_v1/results_v5_multifamily/RESULT.json"
  ],
  "mechanism_gate_state": "UNASSESSED",
  "applicability_gate_state": "UNASSESSED",
  "frozen_before_implementation": true,
  "frozen_before_outcome_access": true,
  "packet_content_sha256": "e3fa30f76f2f380700d98d2fe467ddf539db3b056da73ff03df805c72633e347",
  "grants_scientific_authority": false,
  "grants_promotion_authority": false,
  "replaces_promotion_gate": false
}
